Day,Desicrption,Extra
Wednesday,Pain au Jambon; Pain au Chocolate; Almond Croissant;,Scones; Muffins; Cookies;
Thursday,Bearclaw; Cruffin;,Danish Scones; Muffins; Cookes;
Friday,Morning Bun; Pain auJambon; Pain auChocolate; Almond Croissant,Scones; Muffins; Cookies;
Saturday,"Morning Bun, Pain au Jambon; Pain auChocolate; Almond Croissant;",Scones; Muffins; Cookies;
Sunday,"Bearclaw, Croissant, Pain au Chocolate, Danish; Pain au Jambon; Almond Croissant",Scones; Cookis;
Look for additional Speciality Items such as,Pies; cakes; pana cotta; whoopie pies,brownies; mousse; hand pies; and tarts; Daily!
Special orders are availale. ,With a 48 hour notice and pre-payment,"We offer breads, pastry and whole pies."
